Symbol,Name,Last Sale,Net Change,% Change,Market Cap,Country,IPO Year,Volume,Sector,Industry
CRNX,Crinetics Pharmaceuticals Inc. Common Stock,$51.62,-0.91,-1.732%,4131438188.00,United States,2018,403931,Health Care,Biotechnology: Pharmaceutical Preparations
CRON,Cronos Group Inc. Common Share,$2.45,0.04,1.66%,936587776.00,Canada,,961618,Health Care, Medicinal Chemicals and Botanical Products 
CROX,Crocs Inc. Common Stock,$136.05,-1.13,-0.824%,8079347209.00,United States,2006,717625,Consumer Discretionary,Shoe Manufacturing
CRSP,CRISPR Therapeutics AG Common Shares,$47.85,-1.00,-2.047%,4075296360.00,Switzerland,2016,1061744,Health Care,Biotechnology: Biological Products (No Diagnostic Substances)
CRSR,Corsair Gaming Inc. Common Stock,$6.55,0.00,0.00%,682158789.00,United States,2020,543315,Technology,Computer peripheral equipment
CRTO,Criteo S.A. American Depositary Shares,$48.54,0.16,0.331%,2717517434.00,France,2013,203904,Consumer Discretionary,Advertising
CRUS,Cirrus Logic Inc. Common Stock,$141.43,-0.33,-0.233%,7553946723.00,United States,1989,302090,Technology,Semiconductors
CRVL,CorVel Corp. Common Stock,$315.73,-1.08,-0.341%,5408831566.00,United States,,34818,Finance,Specialty Insurers
CRVO,CervoMed Inc. Common Stock,$18.26,1.22,7.16%,150713311.00,United States,,93944,Health Care,Biotechnology: Pharmaceutical Preparations
CRVS,Corvus Pharmaceuticals Inc. Common Stock,$4.10,0.30,7.895%,256460252.00,United States,2016,488894,Health Care,Biotechnology: Pharmaceutical Preparations
CRWD,CrowdStrike Holdings Inc. Class A Common Stock,$262.54,2.05,0.787%,63891902163.00,United States,2019,3490763,Technology,Computer Software: Prepackaged Software
CRWS,Crown Crafts Inc Common Stock,$4.65,-0.03,-0.641%,47944843.00,United States,,55775,Consumer Discretionary,Textiles
CSBR,Champions Oncology Inc. Common Stock,$4.49,-0.02,-0.443%,61036009.00,United States,,4066,Health Care,Biotechnology: Biological Products (No Diagnostic Substances)
CSCI,COSCIENS Biopharma Inc. Common Stock,$5.65,-0.36,-5.99%,10130501.00,Canada,,4183,Health Care,Biotechnology: Pharmaceutical Preparations
CSCO,Cisco Systems Inc. Common Stock (DE),$49.46,0.93,1.916%,199265178821.00,United States,1990,27424014,Telecommunications,Computer Communications Equipment
CSGP,CoStar Group Inc. Common Stock,$74.04,-0.51,-0.684%,30342839426.00,United States,1998,1958180,Consumer Discretionary,Business Services
CSGS,CSG Systems International Inc. Common Stock,$46.98,-0.28,-0.592%,1386053712.00,United States,1996,142921,Technology,EDP Services
CSIQ,Canadian Solar Inc. Common Shares (ON),$14.75,0.04,0.272%,975841430.00,Canada,2006,846035,Technology,Semiconductors
CSLM,CSLM Acquisition Corp. Class A Ordinary Share,$11.33,0.02,0.177%,0.00,United States,2022,358,Finance,Blank Checks
CSLMU,CSLM Acquisition Corp. Unit,$11.39,0.00,0.00%,0.00,United States,2022,4,Finance,Blank Checks
CSLMW,CSLM Acquisition Corp. Warrant,$0.1401,0.0081,6.136%,0.00,United States,2022,6125,Finance,Blank Checks
CSLR,Complete Solaria Inc. Common Stock,$1.62,0.01,0.621%,103054353.00,United States,,355304,Technology,Semiconductors
CSLRW,Complete Solaria Inc. Warrants,$0.1225,-0.0009,-0.729%,7792690.00,United States,,600,Technology,Semiconductors
CSPI,CSP Inc. Common Stock,$13.98,0.86,6.555%,136359522.00,United States,1982,97377,Technology,EDP Services
CSQ,Calamos Strategic Total Return Common Stock,$16.87,0.11,0.656%,2680434183.00,United States,2004,324617,Finance,Finance Companies
CSTE,Caesarstone Ltd. Ordinary Shares,$4.37,-0.29,-6.223%,150906815.00,Israel,2012,86626,Industrials,Building Materials
CSTL,Castle Biosciences Inc. Common Stock,$26.99,-0.15,-0.553%,748615152.00,United States,2019,307106,Health Care,Medical Specialities
CSWC,Capital Southwest Corporation Common Stock,$24.35,0.05,0.206%,1141306342.00,United States,,139441,Consumer Discretionary,Textiles
CSWCZ,Capital Southwest Corporation 7.75% Notes due 2028,$26.035,0.1593,0.616%,1220283803.00,United States,,4417,Finance,Finance Companies
CSWI,CSW Industrials Inc. Common Stock,$309.75,-3.56,-1.136%,4810645786.00,United States,,52271,Industrials,Home Furnishings
CSX,CSX Corporation Common Stock,$33.42,-0.21,-0.624%,64792679471.00,United States,,9870518,Industrials,Railroads
CTAS,Cintas Corporation Common Stock,$764.86,-2.88,-0.375%,77074124565.00,United States,1983,267647,Consumer Discretionary,Apparel
CTBI,Community Trust Bancorp Inc. Common Stock,$47.62,0.79,1.687%,859643240.00,United States,,32180,Finance,Major Banks
CTCX,Carmell Corporation Common Stock,$0.956,-0.014,-1.443%,19985569.00,United States,2021,46106,Health Care,Medical/Dental Instruments
CTCXW,Carmell Corporation Warrant,$0.09,0.00,0.00%,1881487.00,United States,2021,142440,Health Care,Medical/Dental Instruments
CTHR,Charles & Colvard Ltd Common Stock,$1.61,0.00,0.00%,4885539.00,United States,1997,10644,Consumer Discretionary,Consumer Specialties
CTKB,Cytek Biosciences Inc. Common Stock,$5.49,0.08,1.479%,721965700.00,United States,2021,549235,Industrials,Biotechnology: Laboratory Analytical Instruments
CTLP,Cantaloupe Inc. Common Stock,$6.96,0.09,1.31%,506755602.00,United States,,174257,Miscellaneous,Office Equipment/Supplies/Services
CTMX,CytomX Therapeutics Inc. Common Stock,$1.20,0.01,0.84%,93741121.00,United States,2015,1267031,Health Care,Biotechnology: Pharmaceutical Preparations
CTNM,Contineum Therapeutics Inc. Class A Common Stock,$17.14,-1.45,-7.80%,440896951.00,United States,2024,68545,Health Care,Biotechnology: Pharmaceutical Preparations
CTNT,Cheetah Net Supply Chain Service Inc. Class A Common Stock,$0.2234,0.0085,3.955%,6842293.00,United States,2023,539660,Consumer Discretionary,Motor Vehicles
CTOR,Citius Oncology Inc. Common Stock,$2.00,-0.25,-11.111%,4710498.00,United States,2022,875237,Finance,Blank Checks
CTRM,Castor Maritime Inc. Common Shares,$4.66,-0.12,-2.51%,45026723.00,Cyprus,,103020,Consumer Discretionary,Marine Transportation
CTRN,Citi Trends Inc. Common Stock,$16.03,-0.13,-0.804%,137782611.00,United States,2005,104312,Consumer Discretionary,Clothing/Shoe/Accessory Stores
CTSH,Cognizant Technology Solutions Corporation Class A Common Stock,$75.86,0.39,0.517%,37600614059.00,United States,1998,2193733,Technology,EDP Services
CTSO,Cytosorbents Corporation Common Stock,$1.04,0.02,1.961%,56478672.00,United States,,66264,Health Care,Medical/Dental Instruments
CTXR,Citius Pharmaceuticals Inc. Common Stock,$0.6031,0.0168,2.865%,108995493.00,United States,,1136322,Health Care,Biotechnology: Pharmaceutical Preparations
CUB,Lionheart Holdings Class A Ordinary Shares,$10.00,0.01,0.10%,317685760.00,United States,2024,445364,Industrials,Industrial Machinery/Components
CUBA,Herzfeld Caribbean Basin Fund Inc. (The) Common Stock,$2.27,0.00,0.00%,0.00,United States,,1586,Finance,Investment Managers
CUBWU,Lionheart Holdings Unit,$10.03,0.01,0.10%,0.00,United States,2024,13220,Finance,Blank Checks
CUBWW,Lionheart Holdings Warrant,$0.0899,0.00,0.00%,0.00,United States,2024,107,,
CUE,Cue Biopharma Inc. Common Stock,$0.679,0.0851,14.329%,33028812.00,United States,2018,192423,Health Care,Biotechnology: Pharmaceutical Preparations
CURI,CuriosityStream Inc. Class A Common Stock,$1.12,-0.09,-7.438%,61152354.00,United States,2020,143242,Consumer Discretionary,Movies/Entertainment
CURIW,CuriosityStream Inc. Warrant,$0.0169,-0.0028,-14.213%,922745.00,United States,2020,788,Consumer Discretionary,Movies/Entertainment
CUTR,Cutera Inc. Common Stock,$0.82,0.0678,9.014%,16504830.00,United States,2004,658248,Health Care,Biotechnology: Electromedical & Electrotherapeutic Apparatus
CVAC,CureVac N.V. Ordinary Shares,$3.24,-0.01,-0.308%,725723307.00,Germany,2020,517511,Health Care,Biotechnology: Pharmaceutical Preparations
CVBF,CVB Financial Corporation Common Stock,$17.08,0.29,1.727%,2385783505.00,United States,,572118,Finance,Major Banks
CVCO,Cavco Industries Inc. Common Stock When Issued,$386.87,-4.41,-1.127%,3192943339.00,United States,,57221,Consumer Discretionary,Homebuilding
CVGI,Commercial Vehicle Group Inc. Common Stock,$3.62,0.08,2.26%,124896411.00,United States,2004,204476,Consumer Discretionary,Auto Parts:O.E.M.
CVGW,Calavo Growers Inc. Common Stock,$24.76,1.27,5.407%,440730352.00,United States,,355778,Consumer Discretionary,Specialty Foods
CVII,Churchill Capital Corp VII Class A Common Stock,$9.99,-0.03,-0.299%,0.00,United States,,19626,Finance,Blank Checks
CVIIU,Churchill Capital Corp VII Units,$9.60,-0.39,-3.904%,,United States,,8630,Finance,Blank Checks
CVIIW,Churchill Capital Corp VII Warrants,$0.25,-0.02,-7.407%,,United States,,250400,Finance,Blank Checks
CVKD,Cadrenal Therapeutics Inc. Common Stock,$0.4449,-0.0591,-11.726%,7122168.00,United States,2023,465259,Health Care,Biotechnology: Pharmaceutical Preparations
CVLT,Commvault Systems Inc. Common Stock,$150.29,2.16,1.458%,6569678169.00,United States,2006,476813,Technology,Computer Software: Prepackaged Software
CVRX,CVRx Inc. Common Stock,$8.07,0.06,0.749%,175810712.00,United States,2021,393652,Health Care,Medical/Dental Instruments
CVV,CVD Equipment Corporation Common Stock,$3.6699,0.0199,0.545%,25255657.00,United States,,8898,Technology,Industrial Machinery/Components
CWBC,Community West Bancshares Common Stock,$19.43,0.29,1.515%,368015042.00,United States,,26017,Finance,Major Banks
CWCO,Consolidated Water Co. Ltd. Ordinary Shares,$27.53,0.65,2.418%,435922656.00,Cayman Islands,,124824,Utilities,Water Supply
CWD,CaliberCos Inc. Class A Common Stock,$0.5901,-0.0249,-4.049%,13008785.00,United States,2023,294681,Finance,Real Estate
CWST,Casella Waste Systems Inc. Class A Common Stock,$105.12,-0.26,-0.247%,6111035253.00,United States,1997,119810,Utilities,Environmental Services
CXAI,CXApp Inc. Class A Common Stock,$2.28,-0.14,-5.785%,34808667.00,United States,2021,2314190,Technology,EDP Services
CXAIW,CXApp Inc. Warrant,$0.212,-0.0039,-1.806%,3236595.00,United States,2021,19202,Technology,EDP Services
CXDO,Crexendo Inc. Common Stock,$5.29,0.30,6.012%,141321858.00,United States,,314048,Telecommunications,Telecommunications Equipment
CYBR,CyberArk Software Ltd. Ordinary Shares,$280.01,3.61,1.306%,11831916633.00,Israel,2014,404267,Technology,Computer Software: Prepackaged Software
CYCC,Cyclacel Pharmaceuticals Inc. Common Stock,$1.27,-0.05,-3.788%,2507239.00,United States,,153176,Health Care,Biotechnology: Pharmaceutical Preparations
CYCCP,Cyclacel Pharmaceuticals Inc. 6% Convertible Preferred Stock,$9.90,0.00,0.00%,19544620.00,United States,,2,Health Care,Biotechnology: Pharmaceutical Preparations
CYCN,Cyclerion Therapeutics Inc. Common Stock,$2.51,-0.3799,-13.146%,6802341.00,United States,,2361,Health Care,Biotechnology: Pharmaceutical Preparations
CYN,Cyngn Inc. Common Stock,$4.17,0.03,0.725%,8450643.00,United States,2021,65953,Technology,EDP Services
CYRX,CryoPort Inc. Common Stock,$9.01,0.03,0.334%,445204769.00,United States,,555278,Health Care,Biotechnology: Pharmaceutical Preparations
CYTH,Cyclo Therapeutics Inc. Common Stock,$1.26,0.05,4.132%,36156995.00,United States,,27940,Health Care,Biotechnology: Biological Products (No Diagnostic Substances)
CYTK,Cytokinetics Incorporated Common Stock,$56.50,-0.56,-0.981%,6647766157.00,United States,2004,1246022,Health Care,Biotechnology: Pharmaceutical Preparations
CYTO,Altamira Therapeutics Ltd. Common Shares,$0.9574,-0.0526,-5.208%,2719518.00,Bermuda,2014,1043397,Health Care,Biotechnology: Pharmaceutical Preparations
CZFS,Citizens Financial Services Inc. Common Stock,$49.31,1.31,2.729%,234712198.00,United States,,2435,Finance,Major Banks
CZNC,Citizens & Northern Corp Common Stock,$19.28,0.23,1.207%,296766320.00,United States,,15351,Finance,Major Banks
CZR,Caesars Entertainment Inc. Common Stock,$36.98,-0.26,-0.698%,8000178316.00,United States,,2847877,Consumer Discretionary,Hotels/Resorts
CZWI,Citizens Community Bancorp Inc. Common Stock,$12.90,0.11,0.86%,132835699.00,United States,2006,98978,Finance,Savings Institutions
DADA,Dada Nexus Limited American Depositary Shares,$1.40,0.09,6.87%,369708977.00,China,2020,1371042,Technology,Computer Software: Programming Data Processing
DAIO,Data I/O Corporation Common Stock,$2.55,0.04,1.594%,23550951.00,United States,1981,2966,Industrials,Electrical Products
DAKT,Daktronics Inc. Common Stock,$15.33,-0.03,-0.195%,709723459.00,United States,1994,482241,Consumer Discretionary,Miscellaneous manufacturing industries
DALN,DallasNews Corporation Series A Common Stock,$4.47,0.19,4.439%,23925630.00,United States,,50659,Consumer Discretionary,Newspapers/Magazines
DARE,Dare Bioscience Inc. Common Stock,$3.57,0.09,2.586%,30510509.00,United States,2014,65149,Health Care,Biotechnology: Pharmaceutical Preparations
DASH,DoorDash Inc. Class A Common Stock,$129.03,-1.26,-0.967%,53101177552.00,United States,,4484693,Consumer Discretionary,Business Services
DATS,DatChat Inc. Common Stock,$1.39,0.00,0.00%,4182967.00,United States,2021,16906,Telecommunications,Telecommunications Equipment
DATSW,DatChat Inc. Series A Warrant,$0.0617,0.0115,22.908%,185676.00,United States,2021,4595,Telecommunications,Telecommunications Equipment
DAVE,Dave Inc. Class A Common Stock,$36.20,0.15,0.416%,458626488.00,United States,,227056,Finance,Finance: Consumer Services
DAVEW,Dave Inc. Warrants,$0.0319,-0.0011,-3.333%,404149.00,United States,,15310,Finance,Finance: Consumer Services
DAWN,Day One Biopharmaceuticals Inc. Common Stock,$13.92,-0.31,-2.178%,1221625548.00,United States,2021,632815,Health Care,Biotechnology: Pharmaceutical Preparations
DBGI,Digital Brands Group Inc. Common Stock,$1.035,0.0085,0.828%,2003262.00,United States,2021,101524,Consumer Discretionary,Clothing/Shoe/Accessory Stores
DBGIW,Digital Brands Group Inc. Warrant,$11.61,0.00,0.00%,22471376.00,United States,2021,369,Consumer Discretionary,Clothing/Shoe/Accessory Stores
DBVT,DBV Technologies S.A. American Depositary Shares,$0.9325,-0.0125,-1.323%,89985249.00,France,2014,5736,Health Care,Biotechnology: Biological Products (No Diagnostic Substances)
DBX,Dropbox Inc. Class A Common Stock,$22.87,0.07,0.307%,7442300512.00,United States,2018,3981063,Technology,Computer Software: Prepackaged Software
DCBO,Docebo Inc. Common Shares,$42.14,0.08,0.19%,1273931264.00,Canada,,54234,Technology,Computer Software: Prepackaged Software
DCGO,DocGo Inc. Common Stock,$3.50,-0.14,-3.846%,358110288.00,United States,2020,644026,Health Care,Medical/Nursing Services
DCOM,Dime Community Bancshares Inc. Common Stock,$23.43,0.46,2.003%,917252565.00,United States,,85839,Finance,Major Banks
DCOMG,Dime Community Bancshares Inc. 9.000% Fixed-to-Floating Rate Subordinated Notes due 2034,$25.83,0.11,0.428%,1011209294.00,United States,,11912,Finance,Major Banks
DCOMP,Dime Community Bancshares Inc. Fixed-Rate Non-Cumulative Perpetual Preferred Stock Series A,$18.87,-0.08,-0.422%,738734780.00,United States,,9339,Finance,Major Banks
DCTH,Delcath Systems Inc. Common Stock,$7.50,0.01,0.134%,209996415.00,United States,,113444,Health Care,Medical/Dental Instruments
DDI,DoubleDown Interactive Co. Ltd. American Depository Shares,$13.21,0.67,5.343%,654600942.00,South Korea,2021,64019,Technology,EDP Services
DDOG,Datadog Inc. Class A Common Stock,$114.98,-1.35,-1.16%,35771469193.00,United States,2019,2196876,Technology,Computer Software: Prepackaged Software
DECA,Denali Capital Acquisition Corp. Class A Ordinary Shares,$11.509,0.00,0.00%,0.00,United States,2022,105,Finance,Blank Checks
DECAU,Denali Capital Acquisition Corp. Unit,$11.53,-0.02,-0.173%,0.00,United States,2022,300,Finance,Blank Checks
DECAW,Denali Capital Acquisition Corp. Warrant,$0.043,0.00,0.00%,0.00,United States,2022,998,Finance,Blank Checks
DENN,Denny's Corporation Common Stock,$6.15,0.00,0.00%,315949909.00,United States,,701608,Consumer Discretionary,Restaurants
DERM,Journey Medical Corporation Common Stock,$4.43,-0.13,-2.851%,91821660.00,United States,2021,59818,Health Care,Biotechnology: Pharmaceutical Preparations
DFLI,Dragonfly Energy Holdings Corp. Common Stock (NV),$0.6224,0.0174,2.876%,38956745.00,United States,2021,442947,Miscellaneous,Industrial Machinery/Components
DFLIW,Dragonfly Energy Holdings Corp. Warrant,$0.0434,-0.006,-12.146%,2716457.00,United States,2021,100,Miscellaneous,Industrial Machinery/Components
DGHI,Digihost Technology Inc. Common Subordinate Voting Shares,$1.12,-0.045,-3.863%,33600391.00,Canada,,38395,Finance,Finance: Consumer Services
DGICA,Donegal Group Inc. Class A Common Stock,$14.77,0.08,0.545%,494553511.00,United States,,43304,Finance,Property-Casualty Insurers
DGICB,Donegal Group Inc. Class B Common Stock,$12.20,0.2799,2.348%,408500530.00,United States,1986,1735,Finance,Property-Casualty Insurers
DGII,Digi International Inc. Common Stock,$29.04,0.01,0.034%,1057496943.00,United States,1989,174136,Telecommunications,Computer Communications Equipment
DGLY,Digital Ally Inc. Common Stock,$1.47,0.01,0.685%,4233344.00,United States,,1029493,Technology,Radio And Television Broadcasting And Communications Equipment
DH,Definitive Healthcare Corp. Class A Common Stock,$4.02,0.01,0.249%,470834910.00,United States,2021,4629096,Technology,Computer Software: Prepackaged Software
DHAI,DIH Holdings US Inc. Class A Common Stock,$2.49,0.06,2.469%,100956888.00,United States,2024,9461,Health Care,Medical/Dental Instruments
DHAIW,DIH Holding US Inc. Warrants,$0.046,0.00,0.00%,1865067.00,United States,2024,28,Health Care,Medical/Dental Instruments
DHC,Diversified Healthcare Trust Common Shares of Beneficial Interest,$3.17,-0.02,-0.627%,762621517.00,United States,,364144,Real Estate,Real Estate Investment Trusts
DHCNI,Diversified Healthcare Trust 5.625% Senior Notes due 2042,$14.125,-0.155,-1.085%,3398116380.00,United States,,21015,Real Estate,Real Estate Investment Trusts
DHCNL,Diversified Healthcare Trust 6.25% Senior Notes Due 2046,$15.15,0.05,0.331%,3644705357.00,United States,,19556,Real Estate,Real Estate Investment Trusts
DHIL,Diamond Hill Investment Group Inc. Class A Common Stock,$156.00,2.47,1.609%,429159588.00,United States,,22856,Finance,Investment Managers
DIBS,1stdibs.com Inc. Common Stock,$4.35,0.09,2.113%,172665150.00,United States,2021,75513,Consumer Discretionary,Catalog/Specialty Distribution
DIOD,Diodes Incorporated Common Stock,$67.24,0.65,0.976%,3115335506.00,United States,,406972,Technology,Semiconductors
DIST,Distoken Acquisition Corporation Ordinary Shares,$10.82,0.03,0.278%,0.00,China,2023,702,Finance,Blank Checks
DISTW,Distoken Acquisition Corporation Warrant,$0.02,-0.0199,-49.875%,0.00,China,2023,1297,Finance,Blank Checks
DJCO,Daily Journal Corp. (S.C.) Common Stock,$448.71,4.18,0.94%,618064820.00,United States,,4160,Consumer Discretionary,Newspapers/Magazines
DJT,Trump Media & Technology Group Corp. Common Stock,$23.06,-0.51,-2.164%,4490145702.00,United States,2024,4199291,Technology,Computer Software: Programming Data Processing
DJTWW,Trump Media & Technology Group Corp. Warrants,$15.09,-0.0008,-0.005%,2938260999.00,United States,2021,48445,Technology,Computer Software: Programming Data Processing
DKNG,DraftKings Inc. Class A Common Stock,$34.14,0.00,0.00%,16576008027.00,United States,2019,9451701,Consumer Discretionary,Services-Misc. Amusement & Recreation
DLHC,DLH Holdings Corp.,$10.58,0.17,1.633%,150054987.00,United States,,36171,Consumer Discretionary,Professional Services
DLO,DLocal Limited Class A Common Shares,$8.37,0.34,4.234%,2477450236.00,Uruguay,2021,2743604,Consumer Discretionary,Business Services
DLPN,Dolphin Entertainment Inc. Common Stock,$0.7283,0.0063,0.873%,16180183.00,United States,,12084,Consumer Discretionary,Other Consumer Services
DLTH,Duluth Holdings Inc. Class B Common Stock,$3.34,0.03,0.906%,117118743.00,United States,2015,112360,Consumer Discretionary,Clothing/Shoe/Accessory Stores
DLTR,Dollar Tree Inc. Common Stock,$98.78,1.59,1.636%,21232168320.00,United States,1995,1901104,Consumer Discretionary,Department/Specialty Retail Stores
DMAC,DiaMedica Therapeutics Inc. Common Stock,$3.60,0.09,2.564%,153892195.00,United States,2018,15627,Health Care,Biotechnology: Pharmaceutical Preparations
DMLP,Dorchester Minerals L.P. Common Units Representing Limited Partnership Interests,$31.34,-0.01,-0.032%,1256377100.00,United States,,49412,Energy,Oil & Gas Production
DMRC,Digimarc Corporation Common Stock,$26.07,0.06,0.231%,558435694.00,United States,,106668,Technology,EDP Services
DNLI,Denali Therapeutics Inc. Common Stock,$23.02,-0.65,-2.746%,3295664377.00,United States,2017,862916,Health Care,Biotechnology: Biological Products (No Diagnostic Substances)
DNTH,Dianthus Therapeutics Inc. Common Stock,$28.75,-1.06,-3.556%,843936700.00,United States,2018,119413,Health Care,Biotechnology: Pharmaceutical Preparations
DNUT,Krispy Kreme Inc. Common Stock,$11.09,0.16,1.464%,1880864000.00,United States,2021,1355505,Consumer Staples,Food Chains
DOCU,DocuSign Inc. Common Stock,$56.80,0.34,0.602%,11627888907.00,United States,1989,1250022,Technology,Computer Software: Prepackaged Software
DOGZ,Dogness (International) Corporation Class A Common Stock,$20.21,3.37,20.012%,214665830.00,China,2017,47773,Consumer Discretionary,Miscellaneous manufacturing industries
DOMH,Dominari Holdings Inc. Common Stock,$1.58,-0.11,-6.509%,9916298.00,United States,,10829,Health Care,Biotechnology: Pharmaceutical Preparations
DOMO,Domo Inc. Class B Common Stock,$8.18,0.20,2.506%,312269071.00,United States,2018,774134,Technology,Computer Software: Prepackaged Software
DOOO,BRP Inc. (Recreational Products) Common Subordinate Voting Shares,$69.05,0.50,0.729%,5175744184.00,Canada,,37293,Consumer Discretionary,Industrial Specialties
DORM,Dorman Products Inc. Common Stock,$105.44,-2.11,-1.962%,3223541941.00,United States,,94818,Consumer Discretionary,Auto Parts:O.E.M.
DOX,Amdocs Limited Ordinary Shares,$83.88,0.27,0.323%,9843135058.00,Guernsey,,367050,Technology,EDP Services
DOYU,DouYu International Holdings Limited ADS,$18.83,0.58,3.178%,595697858.00,China,2019,270920,Technology,Computer Software: Programming Data Processing
DPCS,DP Cap Acquisition Corp I Class A Ordinary Shares,$11.35,0.01,0.088%,0.00,United States,2021,9428,Finance,Blank Checks
DPCSU,DP Cap Acquisition Corp I Unit,$11.21,0.20,1.817%,0.00,United States,2021,2018,Finance,Blank Checks
DPRO,Draganfly Inc. Common Shares,$0.1355,0.00,0.00%,8589781.00,Canada,,2983123,Industrials,Aerospace
DRCT,Direct Digital Holdings Inc. Class A Common Stock,$3.31,-0.04,-1.194%,47235107.00,United States,2022,28483,Consumer Discretionary,Advertising
DRIO,DarioHealth Corp. Common Stock,$0.8833,0.0126,1.447%,26523980.00,Israel,,23320,Health Care,Medical/Dental Instruments
DRMA,Dermata Therapeutics Inc. Common Stock,$1.96,-0.10,-4.854%,2579323.00,United States,2021,84028,Health Care,Biotechnology: Pharmaceutical Preparations
DRMAW,Dermata Therapeutics Inc. Warrant,$0.0148,0.0002,1.37%,19477.00,United States,2021,400,Health Care,Biotechnology: Pharmaceutical Preparations
DRRX,DURECT Corporation Common Stock,$1.12,-0.03,-2.609%,34764107.00,United States,2000,64033,Health Care,Biotechnology: Pharmaceutical Preparations
DRS,Leonardo DRS Inc. Common Stock,$27.75,-0.05,-0.18%,7317752894.00,Israel,,1024239,Industrials,Industrial Machinery/Components
DRTS,Alpha Tau Medical Ltd. Ordinary Shares,$2.18,-0.07,-3.111%,151881934.00,Israel,,22699,Health Care,Medical/Dental Instruments
DRTSW,Alpha Tau Medical Ltd. Warrant,$0.20,0.02,11.111%,13934122.00,Israel,,567,Health Care,Medical/Dental Instruments
DRUG,Bright Minds Biosciences Inc. Common Stock,$1.07,0.04,3.883%,4776306.00,Canada,,4569,Health Care,Biotechnology: Pharmaceutical Preparations
DRVN,Driven Brands Holdings Inc. Common Stock,$13.79,-0.07,-0.505%,2262689098.00,United States,2021,501548,Consumer Discretionary,Automotive Aftermarket
DSGN,Design Therapeutics Inc. Common Stock,$4.45,0.16,3.73%,251961336.00,United States,2021,82654,Health Care,Biotechnology: Pharmaceutical Preparations
DSGR,Distribution Solutions Group Inc. Common Stock,$34.54,0.26,0.758%,1614999214.00,United States,,41339,Consumer Discretionary,Industrial Specialties
DSGX,Descartes Systems Group Inc. (The) Common Stock,$100.09,0.85,0.857%,8546699313.00,Canada,,102412,Technology,Computer Software: Prepackaged Software
DSP,Viant Technology Inc. Class A Common Stock,$10.29,0.01,0.097%,650318554.00,United States,2021,85427,Technology,Computer Software: Programming Data Processing
DSWL,Deswell Industries Inc. Common Shares,$2.31,0.05,2.212%,36810402.00,Macau,1995,1661,Industrials,Plastic Products
DSY,Big Tree Cloud Holdings Limited Ordinary Shares,$1.87,-0.30,-13.825%,106740621.00,China,,173092,Consumer Discretionary,Containers/Packaging
DSYWW,Big Tree Cloud Holdings Limited Warrants,$0.0473,-0.0043,-8.333%,2699910.00,China,,60372,Consumer Discretionary,Containers/Packaging
DTCK,Davis Commodities Limited Ordinary Shares,$1.29,-0.04,-3.008%,31605806.00,Singapore,2023,167270,Industrials,Farming/Seeds/Milling
DTI,Drilling Tools International Corporation Common Stock,$4.28,-0.02,-0.465%,148536099.00,United States,2021,33087,Industrials,Metal Fabrications
DTIL,Precision BioSciences Inc. Common Stock,$8.83,0.22,2.555%,63874101.00,United States,2019,14378,Health Care,Biotechnology: Biological Products (No Diagnostic Substances)
DTSQU,DT Cloud Star Acquisition Corporation Units,$10.06,0.01,0.10%,0.00,United States,2024,890,,
DTSS,Datasea Inc. Common Stock,$2.06,-0.0838,-3.909%,6299365.00,China,,24045,Technology,Computer Software: Prepackaged Software
DTST,Data Storage Corporation Common Stock,$4.05,-0.10,-2.41%,28333079.00,United States,,106106,Technology,EDP Services
DTSTW,Data Storage Corporation Warrant,$0.6308,-0.0292,-4.424%,4412965.00,United States,,22950,Technology,EDP Services
DUET,DUET Acquisition Corp. Class A Common Stock,$11.20,0.00,0.00%,0.00,Malaysia,2022,101,Finance,Blank Checks
DUO,Fangdd Network Group Ltd. American Depositary Shares,$0.4224,0.0264,6.667%,2538875.00,China,2019,188655,Finance,Real Estate
