Symbol,Name,Last Sale,Net Change,% Change,Market Cap,Country,IPO Year,Volume,Sector,Industry
PXLW,Pixelworks Inc.  Common Stock,$0.7954,0.0146,1.87%,46572009.00,United States,2000,230582,Technology,Semiconductors
PXS,Pyxis Tankers Inc. Common Stock,$5.415,0.165,3.143%,57087892.00,Greece,,50096,Consumer Discretionary,Marine Transportation
PXSAP,Pyxis Tankers Inc. 7.75% Series A Cumulative Convertible Preferred Shares,$24.92,0.24,0.972%,262720271.00,Greece,,1987,Consumer Discretionary,Marine Transportation
PXSAW,Pyxis Tankers Inc. Warrant,$0.9399,0.0798,9.278%,9908940.00,Greece,,19407,Consumer Discretionary,Marine Transportation
PYCR,Paycor HCM Inc. Common Stock,$13.92,0.09,0.651%,2480685037.00,United States,2021,1544119,Technology,Computer Software: Prepackaged Software
PYPD,PolyPid Ltd. Ordinary Shares,$3.75,0.15,4.167%,6200846.00,Israel,2020,2950,Health Care,Medical/Dental Instruments
PYPL,PayPal Holdings Inc. Common Stock,$67.96,0.02,0.029%,69477777388.00,United States,,9511892,Consumer Discretionary,Business Services
PYXS,Pyxis Oncology Inc. Common Stock,$3.36,-0.07,-2.041%,198045936.00,United States,2021,631475,Health Care,Biotechnology: Pharmaceutical Preparations
PZZA,Papa John's International Inc. Common Stock,$46.26,-0.60,-1.28%,1509273486.00,United States,1993,916049,Consumer Discretionary,Restaurants
QCOM,QUALCOMM Incorporated Common Stock,$172.18,-1.16,-0.669%,191808520000.00,United States,1991,5433672,Technology,Radio And Television Broadcasting And Communications Equipment
QCRH,QCR Holdings Inc. Common Stock,$72.17,0.74,1.036%,1215481583.00,United States,,37042,Finance,Major Banks
QDEL,QuidelOrtho Corporation Common Stock,$43.94,-0.71,-1.59%,2954323212.00,United States,,769570,Health Care,Biotechnology: In Vitro & In Vivo Diagnostic Substances
QETA,Quetta Acquisition Corporation Common Stock,$10.37,0.005,0.048%,0.00,United States,2023,1926,Finance,Blank Checks
QFIN,Qifu Technology Inc. American Depositary Shares,$24.50,0.79,3.332%,3803734638.00,China,2018,3118944,Finance,Finance: Consumer Services
QH,Quhuo Limited American Depository Shares,$0.3205,0.0091,2.922%,1976723.00,China,2020,134750,Consumer Discretionary,Business Services
QIPT,Quipt Home Medical Corp. Common Shares,$2.95,0.21,7.664%,125585993.00,United States,,496928,Health Care,Misc Health and Biotechnology Services
QLGN,Qualigen Therapeutics Inc. Common Stock,$0.1942,-0.0028,-1.421%,2360662.00,United States,2015,173303,Health Care,Biotechnology: Pharmaceutical Preparations
QLYS,Qualys Inc. Common Stock,$122.28,-2.66,-2.129%,4501251281.00,United States,2012,520622,Technology,Computer Software: Prepackaged Software
QMCO,Quantum Corporation Common Stock,$0.3188,0.0238,8.068%,30556960.00,United States,,314837,Technology,Electronic Components
QMMM,QMMM Holdings Limited Ordinary Shares,$4.00,-0.02,-0.498%,68500000.00,Hong Kong,2024,261297,Consumer Discretionary,Advertising
QNCX,Quince Therapeutics Inc. Common Stock,$0.5487,0.0082,1.517%,23745874.00,United States,2019,253214,Health Care,Biotechnology: Biological Products (No Diagnostic Substances)
QNRX,Quoin Pharmaceuticals Ltd. American Depositary Shares,$0.4986,-0.0013,-0.26%,1984413.00,Israel,2016,30806,Health Care,Medical/Dental Instruments
QNST,QuinStreet Inc. Common Stock,$17.05,-0.45,-2.571%,942469491.00,United States,2010,345776,Consumer Discretionary,Business Services
QNTM,Quantum Biopharma Ltd. Class B Subordinate Voting Shares,$4.27,0.00,0.00%,5554104.00,Canada,,3425492,Health Care,Biotechnology: Pharmaceutical Preparations
QOMO,Qomolangma Acquisition Corp. Common Stock,$12.22,1.01,9.01%,0.00,United States,2022,2845,Finance,Blank Checks
QOMOR,Qomolangma Acquisition Corp. Right,$0.23,-0.0199,-7.963%,0.00,United States,2022,2800,Finance,Blank Checks
QOMOU,Qomolangma Acquisition Corp. Unit,$12.20,0.19,1.582%,0.00,United States,2022,13526,Finance,Blank Checks
QQQX,Nuveen NASDAQ 100 Dynamic Overwrite Fund Shares of Beneficial Interest,$24.67,0.13,0.53%,0.00,United States,,102273,Finance,Finance Companies
QRHC,Quest Resource Holding Corporation Common Stock,$8.06,-0.04,-0.494%,164290631.00,United States,,59957,Utilities,Environmental Services
QRTEA,Qurate Retail Inc. Series A Common Stock ,$0.5949,0.008,1.363%,236128628.00,United States,,2144385,Consumer Discretionary,Catalog/Specialty Distribution
QRTEB,Qurate Retail Inc. Series B Common Stock ,$4.10,0.40,10.811%,1627378339.00,United States,,26808,Consumer Discretionary,Catalog/Specialty Distribution
QRTEP,Qurate Retail Inc. 8.0% Fixed Rate Cumulative Redeemable Preferred Stock,$40.32,-0.12,-0.297%,16003876735.00,United States,,53875,Consumer Discretionary,Catalog/Specialty Distribution
QRVO,Qorvo Inc. Common Stock,$111.18,-1.20,-1.068%,10546684448.00,United States,,921645,Technology,Semiconductors
QSG,QuantaSing Group Limited American Depositary Shares,$1.74,0.13,8.075%,96058704.00,China,2023,69062,Real Estate,Other Consumer Services
QSI,Quantum-Si Incorporated Class A Common Stock,$0.9747,-0.0453,-4.441%,138759561.00,United States,2020,469789,Industrials,Industrial Machinery/Components
QSIAW,Quantum-Si Incorporated Warrant,$0.14,0.0051,3.781%,19930582.00,United States,2020,1139,Industrials,Industrial Machinery/Components
QTI,QT Imaging Holdings Inc. Common Stock,$0.507,0.033,6.962%,10870798.00,United States,,19141,Health Care,Biotechnology: Electromedical & Electrotherapeutic Apparatus
QTRX,Quanterix Corporation Common Stock,$12.40,1.05,9.251%,475900009.00,United States,2017,820058,Industrials,Biotechnology: Laboratory Analytical Instruments
QTTB,Q32 Bio Inc. Common Stock,$36.91,0.24,0.654%,445126701.00,United States,2018,56091,Health Care,Biotechnology: Pharmaceutical Preparations
QUBT,Quantum Computing Inc. Common Stock,$0.6272,0.0272,4.533%,57299512.00,United States,,394726,Technology,Computer Software: Prepackaged Software
QUIK,QuickLogic Corporation Common Stock,$8.77,-0.17,-1.902%,126863391.00,United States,1999,155831,Technology,Semiconductors
QURE,uniQure N.V. Ordinary Shares,$6.61,-0.12,-1.783%,321891262.00,Netherlands,2014,458046,Health Care,Biotechnology: Pharmaceutical Preparations
QXO,QXO Inc. Common Stock,$12.62,1.27,11.189%,5167009061.00,United States,,3798410,Technology,EDP Services
RAIL,FreightCar America Inc. Common Stock,$5.07,0.60,13.423%,95690420.00,United States,2005,400798,Industrials,Railroads
RAND,Rand Capital Corporation Common Stock,$18.46,0.27,1.484%,47645648.00,United States,,4797,Finance,Finance: Consumer Services
RANI,Rani Therapeutics Holdings Inc. Class A Common Stock,$2.79,0.11,4.104%,149004157.00,United States,2021,36877,Health Care,Biotechnology: Pharmaceutical Preparations
RAPP,Rapport Therapeutics Inc. Common Stock,$20.81,0.43,2.11%,761156070.00,United States,2024,84294,Health Care,Biotechnology: Pharmaceutical Preparations
RAPT,RAPT Therapeutics Inc. Common Stock,$2.19,-0.07,-3.097%,76438612.00,United States,2019,234429,Health Care,Biotechnology: Pharmaceutical Preparations
RARE,Ultragenyx Pharmaceutical Inc. Common Stock,$53.05,1.32,2.552%,4889363330.00,United States,2014,528511,Health Care,Biotechnology: Pharmaceutical Preparations
RAVE,Rave Restaurant Group Inc. Common Stock,$1.80,0.02,1.124%,26255819.00,United States,,15357,Consumer Discretionary,Food Distributors
RAY,Raytech Holding Limited Ordinary Shares,$1.76,0.20,12.821%,30999026.00,Hong Kong,2024,276807,Consumer Discretionary,Consumer Electronics/Appliances
RAYA,Erayak Power Solution Group Inc. Class A Ordinary Shares,$0.84,0.026,3.194%,10458000.00,China,2022,6709,Consumer Discretionary,Metal Fabrications
RBB,RBB Bancorp Common Stock,$21.99,0.11,0.503%,391527288.00,United States,2017,59366,Finance,Major Banks
RBBN,Ribbon Communications Inc. Common Stock,$3.20,0.09,2.894%,558485107.00,United States,,263333,Technology,EDP Services
RBCAA,Republic Bancorp Inc. Class A Common Stock,$59.79,1.32,2.258%,1161963344.00,United States,1998,11961,Finance,Major Banks
RBKB,Rhinebeck Bancorp Inc. Common Stock,$7.88,-0.22,-2.716%,87370343.00,United States,2019,14882,Finance,Banks
RCAT,Red Cat Holdings Inc. Common Stock,$2.75,-0.06,-2.135%,205152027.00,United States,,1005832,Technology,Computer Software: Prepackaged Software
RCEL,Avita Medical Inc. Common Stock,$9.08,-0.23,-2.47%,235986467.00,United States,,188688,Health Care,Medical/Dental Instruments
RCKT,Rocket Pharmaceuticals Inc. Common Stock,$18.97,0.37,1.989%,1725812045.00,United States,2015,793594,Health Care,Biotechnology: Pharmaceutical Preparations
RCKY,Rocky Brands Inc. Common Stock,$29.31,0.88,3.095%,218330776.00,United States,1993,62320,Consumer Discretionary,Shoe Manufacturing
RCM,R1 RCM Inc. Common Stock,$13.99,0.02,0.143%,5905304392.00,United States,,3700598,Consumer Discretionary,Other Consumer Services
RCMT,RCM Technologies Inc. Common Stock,$19.07,0.43,2.307%,145484420.00,United States,,116654,Consumer Discretionary,Professional Services
RCON,Recon Technology Ltd. Class A Ordinary Shares,$2.145,0.015,0.704%,32127716.00,China,2009,31752,Energy,Oilfield Services/Equipment
RCRT,Recruiter.com Group Inc. Common Stock,$1.93,-0.03,-1.531%,6387493.00,United States,,6310,Technology,EDP Services
RCRTW,Recruiter.com Group Inc. Warrant,$0.0053,-0.004,-43.011%,17541.00,United States,,8100,Technology,EDP Services
RDCM,Radcom Ltd. Ordinary Shares,$9.81,0.13,1.343%,150168851.00,Israel,1997,33455,Technology,Computer peripheral equipment
RDFN,Redfin Corporation Common Stock,$7.46,-0.14,-1.842%,908435980.00,United States,2017,2939117,Finance,Real Estate
RDHL,Redhill Biopharma Ltd. American Depositary Shares,$0.2901,-0.0849,-22.64%,9244615.00,Israel,,2369124,Health Care,Biotechnology: Pharmaceutical Preparations
RDI,Reading International Inc Class A Common Stock,$1.41,0.03,2.174%,31620919.00,United States,,5977,Consumer Discretionary,Movies/Entertainment
RDIB,Reading International Inc Class B Common Stock,$11.09,-0.45,-3.899%,248706381.00,United States,,1647,Consumer Discretionary,Movies/Entertainment
RDNT,RadNet Inc. Common Stock,$64.40,0.95,1.497%,4762847544.00,United States,,416710,Health Care,Medical Specialities
RDUS,Radius Recycling Inc. Class A Common Stock,$14.61,0.19,1.318%,409656423.00,United States,,98002,Consumer Discretionary,Industrial Specialties
RDVT,Red Violet Inc. Common Stock ,$28.30,0.70,2.536%,388601903.00,United States,,66266,Technology,Computer Software: Prepackaged Software
RDWR,Radware Ltd. Ordinary Shares,$22.20,0.18,0.817%,925715047.00,Israel,1999,448975,Consumer Discretionary,Business Services
RDZN,Roadzen Inc. Ordinary Shares,$1.39,-0.02,-1.418%,95132752.00,United States,2022,47299,Finance,Specialty Insurers
RDZNW,Roadzen Inc. Warrants,$0.0835,-0.0005,-0.595%,5714809.00,United States,2022,200,Finance,Specialty Insurers
REAL,The RealReal Inc. Common Stock,$2.64,-0.11,-4.00%,286435261.00,United States,2019,1481413,Consumer Discretionary,Other Specialty Stores
REAX,The Real Brokerage Inc. Common Shares,$6.49,0.39,6.393%,1168200000.00,Canada,,1882916,Finance,Real Estate
REBN,Reborn Coffee Inc. Common Stock,$3.62,-0.13,-3.467%,12186821.00,United States,2022,144169,Consumer Discretionary,Restaurants
RECT,Rectitude Holdings Ltd Ordinary Shares,$2.9997,-0.0603,-1.971%,43495650.00,Singapore,2024,8311,Consumer Discretionary,Industrial Machinery/Components
REE,REE Automotive Ltd. Class A Ordinary Shares,$3.3901,0.0221,0.656%,38080417.00,Israel,,4102,Consumer Discretionary,Auto Manufacturing
REFI,Chicago Atlantic Real Estate Finance Inc. Common Stock,$15.50,0.18,1.175%,304179099.00,United States,2021,93423,Real Estate,Real Estate Investment Trusts
REFR,Research Frontiers Incorporated Common Stock,$2.17,0.02,0.93%,72733598.00,United States,,19976,Miscellaneous,Multi-Sector Companies
REG,Regency Centers Corporation Common Stock,$69.77,-0.24,-0.343%,12663024340.00,United States,1993,697498,Real Estate,Real Estate Investment Trusts
REGCO,Regency Centers Corporation 5.875% Series B Cumulative Redeemable Preferred Stock,$22.26,0.07,0.315%,4040116408.00,United States,,4333,Real Estate,Real Estate Investment Trusts
REGCP,Regency Centers Corporation 6.25% Series A Cumulative Redeemable Preferred Stock,$23.99,0.63,2.697%,4354105689.00,United States,,360,Real Estate,Real Estate Investment Trusts
REGN,Regeneron Pharmaceuticals Inc. Common Stock,$1179.31,3.98,0.339%,130000682395.00,United States,1991,564436,Health Care,Biotechnology: Pharmaceutical Preparations
REKR,Rekor Systems Inc. Common Stock,$1.31,0.03,2.344%,115939592.00,United States,,1843651,Telecommunications,Telecommunications Equipment
RELI,Reliance Global Group Inc. Common Stock,$2.5704,-0.0596,-2.266%,3185772.00,United States,,29755,Finance,Specialty Insurers
RELIW,Reliance Global Group Inc. Series A Warrants,$0.07,0.00,0.00%,86758.00,United States,,114,Finance,Specialty Insurers
RELL,Richardson Electronics Ltd. Common Stock,$11.54,-0.13,-1.114%,165910245.00,United States,1983,63547,Technology,Electronic Components
RELY,Remitly Global Inc. Common Stock,$14.48,0.38,2.695%,2825577128.00,United States,2021,955247,Consumer Discretionary,Business Services
RENB,Renovaro Inc. Common Stock,$0.6783,-0.001,-0.147%,100052604.00,United States,,206170,Health Care,Biotechnology: Pharmaceutical Preparations
RENE,Cartesian Growth Corporation II Class A Ordinary Shares,$11.36,-0.01,-0.088%,0.00,United States,2022,9693,Finance,Blank Checks
RENEU,Cartesian Growth Corporation II Unit,$11.62,0.31,2.741%,0.00,United States,2022,300,Finance,Blank Checks
RENEW,Cartesian Growth Corporation II Warrant,$0.082,0.012,17.143%,0.00,United States,2022,707,Finance,Blank Checks
RENT,Rent the Runway Inc. Class A Common Stock,$13.26,1.46,12.373%,49350723.00,United States,2021,38699,Consumer Discretionary,Other Specialty Stores
REPL,Replimune Group Inc. Common Stock,$10.11,-0.19,-1.845%,690729314.00,United States,2018,428582,Health Care,Biotechnology: Biological Products (No Diagnostic Substances)
RETO,ReTo Eco-Solutions Inc. Class A Shares,$1.005,0.0051,0.51%,3763915.00,China,2017,4533,Industrials,Industrial Machinery/Components
REVB,Revelation Biosciences Inc. Common Stock,$0.861,-0.0344,-3.842%,1414963.00,United States,2020,85353,Health Care,Biotechnology: Pharmaceutical Preparations
REVBW,Revelation Biosciences Inc. Warrant,$0.0101,0.0007,7.447%,16598.00,United States,2020,22332,Health Care,Biotechnology: Pharmaceutical Preparations
REYN,Reynolds Consumer Products Inc. Common Stock,$30.15,-0.05,-0.166%,6335670378.00,United States,2020,497258,Consumer Discretionary,Containers/Packaging
RFAI,RF Acquisition Corp II Ordinary Shares,$10.08,0.00,0.00%,0.00,Singapore,2024,2,,
RFAIR,RF Acquisition Corp II Right,$0.079,0.013,19.697%,0.00,Singapore,2024,5701,Finance,Blank Checks
RFIL,RF Industries Ltd. Common Stock,$3.49,0.05,1.453%,36629463.00,United States,,12688,Technology,Electrical Products
RGC,Regencell Bioscience Holdings Limited Ordinary Shares,$8.42,-0.43,-4.859%,109568332.00,Hong Kong,2021,39683,Health Care, Medicinal Chemicals and Botanical Products 
RGCO,RGC Resources Inc. Common Stock,$20.54,0.05,0.244%,209896083.00,United States,,5038,Utilities,Oil & Gas Production
RGEN,Repligen Corporation Common Stock,$147.55,-15.06,-9.261%,8263758780.00,United States,1986,3166401,Health Care,Biotechnology: Biological Products (No Diagnostic Substances)
RGF,The Real Good Food Company Inc. Class A Common Stock,$0.4248,-0.0052,-1.209%,14309050.00,United States,2021,26702,Consumer Staples,Packaged Foods
RGLD,Royal Gold Inc. Common Stock,$136.53,3.77,2.84%,8975599070.00,United States,,306135,Industrials,Precious Metals
RGLS,Regulus Therapeutics Inc. Common Stock,$1.61,0.02,1.258%,105400060.00,United States,2012,139686,Health Care,Biotechnology: Pharmaceutical Preparations
RGNX,REGENXBIO Inc. Common Stock,$12.25,-0.16,-1.289%,605434053.00,United States,2015,319356,Health Care,Biotechnology: Biological Products (No Diagnostic Substances)
RGP,Resources Connection Inc. Common Stock,$10.18,-0.02,-0.196%,341642327.00,United States,,273246,Consumer Discretionary,Business Services
RGS,Regis Corporation Common Stock,$22.77,-1.37,-5.675%,51914416.00,United States,1991,63767,Consumer Discretionary,Other Consumer Services
RGTI,Rigetti Computing Inc. Common Stock,$0.8982,0.0126,1.423%,171774905.00,United States,,3114034,Technology,EDP Services
RGTIW,Rigetti Computing Inc. Warrants,$0.1424,0.0176,14.103%,27233073.00,United States,,11206,Technology,EDP Services
RICK,RCI Hospitality Holdings Inc. Common Stock,$44.76,-0.90,-1.971%,402685399.00,United States,1995,90641,Consumer Discretionary,Restaurants
RIGL,Rigel Pharmaceuticals Inc. Common Stock,$12.11,-0.36,-2.887%,213075171.00,United States,2000,61550,Health Care,Biotechnology: Pharmaceutical Preparations
RILY,B. Riley Financial Inc. Common Stock,$5.85,0.81,16.071%,177227523.00,United States,,21301041,Finance,Investment Managers
RILYG,B. Riley Financial Inc. 5.00% Senior Notes due 2026,$8.83,1.63,22.639%,267507525.00,United States,,209310,Finance,Investment Managers
RILYK,B. Riley Financial Inc. 5.50% Senior Notes Due 2026,$11.75,2.38,25.40%,355969810.00,United States,,131562,Finance,Investment Managers
RILYL,B. Riley Financial Inc. Depositary Shares each representing 1/1000th in a share of 7.375% Series B Cumulative Perpetual Preferred Stock par value $0.0001,$7.37,3.12,73.412%,223276383.00,United States,,211402,Finance,Investment Managers
RILYM,B. Riley Financial Inc. 6.375% Senior Notes due 2025,$16.21,2.7316,20.267%,491086862.00,United States,,847503,Finance,Investment Managers
RILYN,B. Riley Financial Inc. 6.50% Senior Notes Due 2026,$9.61,2.41,33.472%,291137862.00,United States,,641472,Finance,Investment Managers
RILYP,B. Riley Financial Inc. Depositary Shares each representing a 1/1000th fractional interest in a share of Series A Cumulative Perpetual Preferred Stock,$7.21,2.95,69.249%,218429135.00,United States,,473231,Finance,Investment Managers
RILYT,B. Riley Financial Inc. 6.00% Senior Notes Due 2028,$8.44,1.25,17.385%,255692357.00,United States,,287085,Finance,Investment Managers
RILYZ,B. Riley Financial Inc. 5.25% Senior Notes due 2028,$8.30,1.40,20.29%,251451015.00,United States,,750324,Finance,Investment Managers
RIOT,Riot Platforms Inc. Common Stock ,$7.99,0.31,4.036%,2425157295.00,United States,,17067234,Finance,Finance: Consumer Services
RIVN,Rivian Automotive Inc. Class A Common Stock,$13.21,-0.55,-3.997%,13319294784.00,United States,2021,37709357,Consumer Discretionary,Auto Manufacturing
RKDA,Arcadia Biosciences Inc. Common Stock,$2.6494,-0.1206,-4.354%,3610708.00,United States,2015,2228,Consumer Staples,Farming/Seeds/Milling
RKLB,Rocket Lab USA Inc. Common Stock,$6.56,0.73,12.521%,3257959351.00,United States,2020,74094905,Industrials,Military/Government/Technical
RLAY,Relay Therapeutics Inc. Common Stock,$6.45,-0.22,-3.298%,863590281.00,United States,2020,542554,Health Care,Biotechnology: Biological Products (No Diagnostic Substances)
RLMD,Relmada Therapeutics Inc. Common Stock,$2.50,-0.07,-2.724%,75435505.00,United States,,77565,Health Care,Biotechnology: Pharmaceutical Preparations
RLYB,Rallybio Corporation Common Stock,$1.10,-0.01,-0.901%,45636345.00,United States,2021,55602,Health Care,Biotechnology: Pharmaceutical Preparations
RMBI,Richmond Mutual Bancorporation Inc. Common Stock,$12.29,-0.01,-0.081%,135090537.00,United States,2019,1616,Finance,Major Banks
RMBL,RumbleOn Inc. Class B Common Stock,$4.02,0.05,1.259%,141996390.00,United States,,123577,Technology,EDP Services
RMBS,Rambus Inc. Common Stock,$46.32,-0.35,-0.75%,4987745660.00,United States,1997,1138865,Technology,Semiconductors
RMCF,Rocky Mountain Chocolate Factory Inc. Common Stock,$1.85,0.02,1.093%,11731951.00,United States,,2906,Consumer Staples,Specialty Foods
RMCO,Royalty Management Holding Corporation Class A Common Stock,$0.85,-0.036,-4.063%,12719481.00,United States,2023,24432,Miscellaneous,Multi-Sector Companies
RMCOW,Royalty Management Holding Corporation Warrant,$0.0144,0.00,0.00%,215483.00,United States,2023,7139,Miscellaneous,Multi-Sector Companies
RMNI,Rimini Street Inc. (DE) Common Stock,$1.80,-0.02,-1.099%,163260000.00,United States,2015,85456,Consumer Discretionary,Business Services
RMR,The RMR Group Inc. Class A Common Stock,$24.43,0.17,0.701%,775036937.00,United States,,62044,Consumer Discretionary,Professional Services
RMTI,Rockwell Medical Inc. Common Stock,$2.58,0.02,0.781%,80057962.00,United States,1998,255229,Health Care,Biotechnology: Pharmaceutical Preparations
RNA,Avidity Biosciences Inc. Common Stock,$44.98,-0.51,-1.121%,4938866837.00,United States,2020,1486021,Health Care,Biotechnology: Pharmaceutical Preparations
RNAC,Cartesian Therapeutics Inc. Common Stock,$14.22,-0.23,-1.592%,304058937.00,United States,2016,64597,Health Care,Biotechnology: Pharmaceutical Preparations
RNAZ,TransCode Therapeutics Inc. Common Stock,$0.2666,0.0166,6.64%,4603024.00,United States,2021,1085438,Health Care,Biotechnology: Pharmaceutical Preparations
RNLX,Renalytix plc American Depositary Shares,$0.3831,0.0131,3.541%,31783032.00,United Kingdom,2020,121044,Health Care,Medical Specialities
RNW,ReNew Energy Global plc Class A Ordinary Shares,$5.57,-0.35,-5.912%,448716248.00,United Kingdom,,2193587,Utilities,Electric Utilities: Central
RNWWW,ReNew Energy Global plc Warrant,$0.379,-0.047,-11.033%,30532039.00,United Kingdom,,2449,Utilities,Electric Utilities: Central
RNXT,RenovoRx Inc. Common Stock,$1.18,0.07,6.306%,28304317.00,United States,2021,48129,Health Care,Biotechnology: Pharmaceutical Preparations
ROAD,Construction Partners Inc. Class A Common Stock,$62.08,-0.31,-0.497%,3275447826.00,United States,2018,240203,Industrials,Military/Government/Technical
ROCK,Gibraltar Industries Inc. Common Stock,$65.38,-0.83,-1.254%,1992719439.00,United States,1993,157912,Industrials,Steel/Iron Ore
ROCL,Roth CH Acquisition V Co. Common Stock,$11.25,0.00,0.00%,0.00,United States,2022,2,Finance,Blank Checks
ROCLW,Roth CH Acquisition V Co. Warrant,$0.0579,0.00,0.00%,0.00,United States,2022,500,Finance,Blank Checks
ROIC,Retail Opportunity Investments Corp. Common Stock (MD),$15.20,-0.03,-0.197%,1937306181.00,United States,,970017,Real Estate,Real Estate Investment Trusts
ROIV,Roivant Sciences Ltd. Common Shares,$11.19,-0.12,-1.061%,8275249211.00,United Kingdom,,3011165,Health Care,Biotechnology: Pharmaceutical Preparations
ROKU,Roku Inc. Class A Common Stock,$58.58,-0.69,-1.164%,8475863343.00,United States,2017,1966312,Telecommunications,Cable & Other Pay Television Services
ROMA,Roma Green Finance Limited Ordinary Shares,$0.532,-0.008,-1.481%,6365152.00,Hong Kong,2024,21169,Consumer Discretionary,Professional Services
ROOT,Root Inc. Class A Common Stock,$49.00,3.61,7.953%,735000000.00,United States,2020,351594,Finance,Property-Casualty Insurers
ROP,Roper Technologies Inc. Common Stock,$548.50,1.93,0.353%,58798467753.00,United States,1992,389768,Industrials,Industrial Machinery/Components
ROST,Ross Stores Inc. Common Stock,$147.40,-0.40,-0.271%,49168941144.00,United States,1985,3117169,Consumer Discretionary,Clothing/Shoe/Accessory Stores
RPAY,Repay Holdings Corporation Class A Common Stock,$8.24,-0.02,-0.242%,805444781.00,United States,2018,1299123,Consumer Discretionary,Business Services
RPD,Rapid7 Inc. Common Stock,$37.55,-0.28,-0.74%,2355667595.00,United States,2015,534264,Technology,Computer Software: Prepackaged Software
RPHM,Reneo Pharmaceuticals Inc. Common Stock,$1.55,-0.01,-0.641%,51814652.00,United States,2021,401334,Health Care,Biotechnology: Pharmaceutical Preparations
RPID,Rapid Micro Biosystems Inc. Class A Common Stock,$0.85,0.0194,2.336%,36477028.00,United States,2021,46972,Industrials,Biotechnology: Laboratory Analytical Instruments
RPRX,Royalty Pharma plc Class A Ordinary Shares ,$27.17,-0.03,-0.11%,16124285051.00,United States,2020,1961691,Health Care,Biotechnology: Pharmaceutical Preparations
RPTX,Repare Therapeutics Inc. Common Shares,$2.93,-0.07,-2.333%,124365412.00,Canada,2020,81097,Health Care,Biotechnology: Pharmaceutical Preparations
RR,Richtech Robotics Inc. Class B Common Stock,$0.7525,0.16,27.004%,0.00,United States,2023,22095955,Industrials,Industrial Machinery/Components
RRBI,Red River Bancshares Inc. Common Stock,$51.80,1.06,2.089%,356713085.00,United States,2019,2967,Consumer Discretionary,Hotels/Resorts
RRGB,Red Robin Gourmet Burgers Inc. Common Stock,$4.84,-0.09,-1.826%,75813760.00,United States,2002,262639,Consumer Discretionary,Restaurants
RRR,Red Rock Resorts Inc. Class A Common Stock,$55.60,-0.12,-0.215%,5871617317.00,United States,2016,310454,Consumer Discretionary,Hotels/Resorts
RSLS,ReShape Lifesciences Inc. Common Stock,$0.1793,0.0032,1.817%,5269116.00,United States,2016,553705,Health Care,Medical/Dental Instruments
RSSS,Research Solutions Inc Common Stock,$2.775,0.05,1.835%,89582658.00,United States,,32202,Consumer Discretionary,Business Services
RSTN,RDE Inc. Common Stock,$3.15,-0.39,-11.017%,81623628.00,United States,,9187,Consumer Discretionary,Catalog/Specialty Distribution
RSVR,Reservoir Media Inc. Common Stock,$7.35,0.03,0.41%,478330194.00,United States,2021,54744,Consumer Discretionary,Services-Misc. Amusement & Recreation
RSVRW,Reservoir Media Inc. Warrant,$0.7804,-0.2296,-22.733%,50787603.00,United States,2021,707,Consumer Discretionary,Services-Misc. Amusement & Recreation
RTC,Baijiayun Group Ltd. Class A Ordinary Shares,$8.41,0.33,4.084%,147499147.00,China,2006,17523,Technology,Computer Software: Prepackaged Software
RUM,Rumble Inc. Class A Common Stock,$6.30,0.01,0.159%,2450783960.00,United States,2021,752383,Technology,Computer Software: Programming Data Processing
RUMBW,Rumble Inc. Warrant,$1.12,-0.01,-0.885%,435694926.00,United States,2021,3565,Technology,Computer Software: Programming Data Processing
RUN,Sunrun Inc. Common Stock,$19.40,-0.21,-1.071%,4336670005.00,United States,2015,6931726,Miscellaneous,Industrial Machinery/Components
